{
  "pieza": "lugares-recital",
  "decision": "D-72",
  "actualizado": "2026-10-15",
  "nota": "Lugares para soñar el recital de \"Armá tu recital\": estadios de todo el país y los teatros más conocidos de varias ciudades. No dice que la banda haya tocado en ellos: el juego es una expresión de deseo. Además el jugador puede elegir un descampado en la localidad que escriba, o escribir el lugar que no esté.",
  "lugares": [
    { "slug": "estadio-monumental", "tipo": "estadio", "nombre": "Estadio Monumental", "ciudad": "Buenos Aires" },
    { "slug": "la-bombonera", "tipo": "estadio", "nombre": "La Bombonera", "ciudad": "Buenos Aires" },
    { "slug": "estadio-tomas-a-duco", "tipo": "estadio", "nombre": "Estadio Tomás A. Ducó", "ciudad": "Buenos Aires" },
    { "slug": "estadio-obras", "tipo": "estadio", "nombre": "Estadio Obras", "ciudad": "Buenos Aires" },
    { "slug": "estadio-luna-park", "tipo": "estadio", "nombre": "Estadio Luna Park", "ciudad": "Buenos Aires" },
    { "slug": "movistar-arena", "tipo": "estadio", "nombre": "Movistar Arena", "ciudad": "Buenos Aires" },
    { "slug": "estadio-presidente-peron", "tipo": "estadio", "nombre": "Estadio Presidente Perón", "ciudad": "Avellaneda" },
    { "slug": "estadio-libertadores-de-america", "tipo": "estadio", "nombre": "Estadio Libertadores de América", "ciudad": "Avellaneda" },
    { "slug": "estadio-unico-diego-armando-maradona", "tipo": "estadio", "nombre": "Estadio Único Diego Armando Maradona", "ciudad": "La Plata" },
    { "slug": "estadio-jose-maria-minella", "tipo": "estadio", "nombre": "Estadio José María Minella", "ciudad": "Mar del Plata" },
    { "slug": "estadio-mario-alberto-kempes", "tipo": "estadio", "nombre": "Estadio Mario Alberto Kempes", "ciudad": "Córdoba" },
    { "slug": "gigante-de-arroyito", "tipo": "estadio", "nombre": "Gigante de Arroyito", "ciudad": "Rosario" },
    { "slug": "estadio-marcelo-bielsa", "tipo": "estadio", "nombre": "Estadio Marcelo Bielsa", "ciudad": "Rosario" },
    { "slug": "estadio-brigadier-lopez", "tipo": "estadio", "nombre": "Estadio Brigadier López", "ciudad": "Santa Fe" },
    { "slug": "estadio-malvinas-argentinas", "tipo": "estadio", "nombre": "Estadio Malvinas Argentinas", "ciudad": "Mendoza" },
    { "slug": "estadio-del-bicentenario", "tipo": "estadio", "nombre": "Estadio del Bicentenario", "ciudad": "San Juan" },
    { "slug": "estadio-monumental-jose-fierro", "tipo": "estadio", "nombre": "Estadio Monumental José Fierro", "ciudad": "San Miguel de Tucumán" },
    { "slug": "estadio-padre-ernesto-martearena", "tipo": "estadio", "nombre": "Estadio Padre Ernesto Martearena", "ciudad": "Salta" },
    { "slug": "estadio-unico-madre-de-ciudades", "tipo": "estadio", "nombre": "Estadio Único Madre de Ciudades", "ciudad": "Santiago del Estero" },
    { "slug": "estadio-ruca-che", "tipo": "estadio", "nombre": "Estadio Ruca Che", "ciudad": "Neuquén" },

    { "slug": "teatro-gran-rex", "tipo": "teatro", "nombre": "Teatro Gran Rex", "ciudad": "Buenos Aires" },
    { "slug": "teatro-opera", "tipo": "teatro", "nombre": "Teatro Ópera", "ciudad": "Buenos Aires" },
    { "slug": "teatro-colon", "tipo": "teatro", "nombre": "Teatro Colón", "ciudad": "Buenos Aires" },
    { "slug": "teatro-vorterix", "tipo": "teatro", "nombre": "Teatro Vorterix", "ciudad": "Buenos Aires" },
    { "slug": "teatro-flores", "tipo": "teatro", "nombre": "Teatro Flores", "ciudad": "Buenos Aires" },
    { "slug": "teatro-argentino", "tipo": "teatro", "nombre": "Teatro Argentino", "ciudad": "La Plata" },
    { "slug": "teatro-auditorium", "tipo": "teatro", "nombre": "Teatro Auditorium", "ciudad": "Mar del Plata" },
    { "slug": "teatro-municipal-bahia-blanca", "tipo": "teatro", "nombre": "Teatro Municipal", "ciudad": "Bahía Blanca" },
    { "slug": "teatro-del-libertador-san-martin", "tipo": "teatro", "nombre": "Teatro del Libertador San Martín", "ciudad": "Córdoba" },
    { "slug": "teatro-el-circulo", "tipo": "teatro", "nombre": "Teatro El Círculo", "ciudad": "Rosario" },
    { "slug": "teatro-3-de-febrero", "tipo": "teatro", "nombre": "Teatro 3 de Febrero", "ciudad": "Paraná" },
    { "slug": "teatro-independencia", "tipo": "teatro", "nombre": "Teatro Independencia", "ciudad": "Mendoza" },
    { "slug": "teatro-san-martin-tucuman", "tipo": "teatro", "nombre": "Teatro San Martín", "ciudad": "San Miguel de Tucumán" },
    { "slug": "teatro-provincial-salta", "tipo": "teatro", "nombre": "Teatro Provincial", "ciudad": "Salta" }
  ]
}
